{
  "holding_limit_individual": 300000,
  "holding_limit_merchant": 3000000,
  "offline_cap_per_device": 5000,
  "transfer_velocity_limit_window_seconds": 86400,
  "transfer_velocity_limit_max_amount": 500000,
  "fee_transfer_basis_points": 5,
  "governance_change_delay_seconds": 86400,
  "offline_reconciliation_window_seconds": 604800,
  "offline_daily_velocity_per_wallet": 20000
}
